<?xml version="1.0" encoding="UTF-8"?>
<cim:NotifyValidatedMeasureData_MarketDocument xmlns:xsi="http://www.w3.org/2001/XMLSchema-instance" xmlns:cim="urn:ediel.org:measure:notifyvalidatedmeasuredata:0:1" xsi:schemaLocation="urn:ediel.org:measure:notifyvalidatedmeasuredata:0:1 urn-ediel-org-measure-notifyvalidatedmeasuredata-0-1.xsd">
    <cim:mRID>111131835</cim:mRID>
    <cim:type>E66</cim:type>
    <cim:process.processType>E23</cim:process.processType>
    <cim:businessSector.type>23</cim:businessSector.type>
    <cim:sender_MarketParticipant.mRID codingScheme="A10">5790001330552</cim:sender_MarketParticipant.mRID>
    <cim:sender_MarketParticipant.marketRole.type>MDR</cim:sender_MarketParticipant.marketRole.type>
    <cim:receiver_MarketParticipant.mRID codingScheme="A10">5790000432752</cim:receiver_MarketParticipant.mRID>
    <cim:receiver_MarketParticipant.marketRole.type>DGL</cim:receiver_MarketParticipant.marketRole.type>
    <cim:createdDateTime>2024-07-30T07:30:54Z</cim:createdDateTime>
    <cim:Series>
        <cim:mRID>4413675032_5080574373</cim:mRID>
        <cim:originalTransactionIDReference_Series.mRID>C1875000</cim:originalTransactionIDReference_Series.mRID>
        <cim:marketEvaluationPoint.mRID codingScheme="A10">571313000000002000</cim:marketEvaluationPoint.mRID>
        <cim:marketEvaluationPoint.type>E18</cim:marketEvaluationPoint.type>
        <cim:registration_DateAndOrTime.dateTime>2022-12-17T07:30:00Z</cim:registration_DateAndOrTime.dateTime>
        <cim:product>8716867000030</cim:product>
        <cim:quantity_Measure_Unit.name>KWH</cim:quantity_Measure_Unit.name>
        <cim:Period>
            <cim:resolution>PT1H</cim:resolution>
            <cim:timeInterval>
                <cim:start>2024-06-28T22:00Z</cim:start>
                <cim:end>2024-06-29T22:00Z</cim:end>
            </cim:timeInterval>
            <cim:Point>
                <cim:position>1</cim:position>
                <cim:quantity>56</cim:quantity>
                <cim:quality>A03</cim:quality>
            </cim:Point>
            <cim:Point>
                <cim:position>2</cim:position>
                <cim:quantity>56</cim:quantity>
                <cim:quality>A03</cim:quality>
            </cim:Point>
            <cim:Point>
                <cim:position>3</cim:position>
                <cim:quantity>56</cim:quantity>
                <cim:quality>A03</cim:quality>
            </cim:Point>
            <cim:Point>
                <cim:position>4</cim:position>
                <cim:quantity>56</cim:quantity>
                <cim:quality>A03</cim:quality>
            </cim:Point>
            <cim:Point>
                <cim:position>5</cim:position>
                <cim:quantity>56</cim:quantity>
                <cim:quality>A03</cim:quality>
            </cim:Point>
            <cim:Point>
                <cim:position>6</cim:position>
                <cim:quantity>56</cim:quantity>
                <cim:quality>A03</cim:quality>
            </cim:Point>
        </cim:Period>
    </cim:Series>
</cim:NotifyValidatedMeasureData_MarketDocument>